{
  "defaults": {
    "mode": "monitor",
    "semantic_timeout_ms": 300,
    "on_semantic_timeout": "fail_open"
  },
  "models": {
    "allowed": [
      "llama3.1:8b",
      "qwen2.5:7b"
    ]
  },
  "controls": {
    "pii_regex": {
      "enabled": true,
      "action": "monitor",
      "types": [
        "email",
        "pesel",
        "iban",
        "card"
      ]
    },
    "secrets": {
      "enabled": true,
      "action": "monitor"
    },
    "prompt_injection": {
      "enabled": true,
      "action": "monitor",
      "threshold": 0.95
    },
    "content_safety": {
      "enabled": true,
      "action": "monitor",
      "categories": [
        "S1",
        "S2",
        "S9"
      ]
    },
    "attack_signatures": {
      "enabled": true,
      "action": "monitor",
      "refresh_s": 60
    },
    "agent_loops": {
      "enabled": true,
      "action": "monitor",
      "max_steps": 25,
      "max_identical_tool_calls": 3
    },
    "mcp_tools": {
      "enabled": true,
      "action": "monitor",
      "allowed": {
        "demo-agent": [
          "search",
          "calculator"
        ]
      },
      "pinned_hashes": {}
    }
  },
  "budgets": [
    {
      "subject": "team:finance",
      "monthly_usd": 50,
      "daily_tokens": 200000,
      "on_exceed": "alert"
    },
    {
      "subject": "model:local/*",
      "gpu_seconds_per_hour": 600,
      "on_exceed": "alert"
    }
  ]
}
